{
  "id": "decision-making--group-decisions-and-crowd-wisdom--t-the-abilene-paradox",
  "version": 1,
  "subject": "Decision Making",
  "subcategory": "Group Decisions and Crowd Wisdom",
  "course_id": "decision-making--group-decisions-and-crowd-wisdom",
  "chapter_id": "decision-making--group-decisions-and-crowd-wisdom--ch02-groupthink",
  "title": "The Abilene Paradox",
  "emoji": "👥",
  "color": "#D97706",
  "description": "A short lesson to help you apply The Abilene Paradox.",
  "is_free": false,
  "published": true,
  "story": {
    "hook": {
      "text": "A Texas family drove 53 miles to Abilene in brutal heat for dinner. Afterward, nobody wanted to go.",
      "visual": "🚗"
    },
    "buildup": {
      "text": "Each person agreed to go because they thought the others wanted to. Nobody spoke their true preference.",
      "visual": "🤐"
    },
    "discovery": {
      "text": "The Abilene Paradox is collective agreement on something nobody actually wants. Groups do things no member supports.",
      "visual": "😰"
    },
    "twist": {
      "text": "It is the opposite of groupthink. Groupthink suppresses dissent.",
      "visual": "🔄"
    },
    "climax": {
      "text": "Many meetings end with everyone agreeing to a plan nobody likes.",
      "visual": "❓"
    },
    "punchline": {
      "text": "Everyone agreed. Nobody wanted to go. False consensus is silent and universal.",
      "visual": "🚗"
    }
  },
  "quiz": {
    "question": "What is the Abilene Paradox?",
    "options": [
      "No one can agree",
      "A group agrees to something no individual member actually wants",
      "People always dissent"
    ],
    "correct": 1
  }
}
