{
  "id": "cooking--story-of-bread--t-challah-bread-as-ritual",
  "version": 1,
  "subject": "Cooking",
  "subcategory": "The Story of Bread",
  "course_id": "cooking--story-of-bread",
  "chapter_id": "cooking--story-of-bread--ch04-breads-of-the-world",
  "title": "Challah: Bread as Ritual",
  "emoji": "🍞",
  "color": "#D4AC0D",
  "description": "A 60-second lesson on Challah: Bread as Ritual.",
  "is_free": false,
  "published": true,
  "story": {
    "hook": {
      "text": "Every Friday before sunset, Jewish families braid and bake challah — bread that connects food to faith.",
      "visual": "🕯️"
    },
    "buildup": {
      "text": "Challah dough is enriched with eggs and honey, then braided — typically in three or six strands.",
      "visual": "🍯"
    },
    "discovery": {
      "text": "The braids symbolize different things — love intertwined, arms embracing, or the twelve tribes of Israel.",
      "visual": "✡️"
    },
    "twist": {
      "text": "On Rosh Hashanah, challah is baked round — symbolizing the cycle of the year and the crown of God.",
      "visual": "👑"
    },
    "climax": {
      "text": "The mitzvah of 'taking challah' — pinching off and burning a small piece — dates to Temple-era offerings.",
      "visual": "🔥"
    },
    "punchline": {
      "text": "Challah isn't just bread. It's prayer you can eat.",
      "visual": "🙏"
    }
  },
  "quiz": {
    "question": "Why is challah baked round on Rosh Hashanah?",
    "options": [
      "It's easier to bake",
      "It symbolizes the cycle of the year",
      "It fits the oven better"
    ],
    "correct": 1
  },
  "details": {
    "summary": "Challah is an enriched Jewish bread braided and eaten on Sabbath and holidays, made with eggs, oil, and sugar. The braiding represents unity and the bread's separation from everyday food marks sacred time. A portion of dough called challah is traditionally torn off and burned as an offering.",
    "whyItMatters": "Challah demonstrates how bread transcends nutrition to become ritual and identity. Its preparation marks the boundary between ordinary time and sacred time in Jewish practice.",
    "takeaways": [
      "Enriched with eggs and oil for softness and golden color",
      "Braiding carries symbolic meaning about unity and interconnection",
      "The name refers to the dough offering, not the bread itself"
    ],
    "keywords": [
      "challah",
      "Jewish bread",
      "braided bread",
      "Sabbath bread"
    ],
    "faq": [
      {
        "question": "Why is challah braided rather than shaped as a simple loaf?",
        "answer": "The braids carry symbolic meaning — three strands represent truth, peace, and justice. Six strands represent the twelve tribes of Israel. On Rosh Hashanah, challah is shaped round to symbolize the cycle of the year. The braiding ritual connects the baker to generations of tradition."
      },
      {
        "question": "What makes challah different from other enriched breads?",
        "answer": "Challah uses eggs and oil but traditionally no dairy, keeping it pareve — neutral under Jewish dietary law so it can be eaten with either meat or dairy meals. Brioche uses butter. This dairy-free enrichment gives challah its particular tender but slightly drier texture."
      }
    ]
  }
}
