{
  "id": "travel--iconic-landmarks--t-the-golden-gate-bridge",
  "version": 1,
  "subject": "Travel",
  "subcategory": "Iconic Landmarks of the World",
  "course_id": "travel--iconic-landmarks",
  "chapter_id": "travel--iconic-landmarks--ch06-modern-architectural-icons",
  "title": "The Golden Gate Bridge",
  "emoji": "ğŸ—½",
  "color": "#2563EB",
  "description": "A fast breakdown of The Golden Gate Bridge for builders.",
  "is_free": false,
  "published": true,
  "story": {
    "hook": {
      "text": "Engineers said a bridge across the Golden Gate strait was impossible. The currents were too violent.",
      "visual": "ğŸŒ‰"
    },
    "buildup": {
      "text": "Joseph Strauss spent 20 years convincing San Francisco it could be done. Construction began in 1933.",
      "visual": "ğŸ—ï¸"
    },
    "discovery": {
      "text": "A safety net saved 19 falling workers. They called themselves the 'Halfway to Hell Club.'",
      "visual": "ğŸ›¡ï¸"
    },
    "twist": {
      "text": "The bridge's famous orange color was supposed to be temporary primer. The architect liked it and kept it.",
      "visual": "ğŸ§¡"
    },
    "climax": {
      "text": "On opening day in 1937, 200,000 people walked across before cars were allowed on.",
      "visual": "ğŸš¶"
    },
    "punchline": {
      "text": "The impossible bridge became America's most loved.",
      "visual": "ğŸŒ‰"
    }
  },
  "quiz": {
    "question": "Why is the Golden Gate Bridge orange?",
    "options": [
      "It represents California sunsets",
      "The architect liked the temporary primer color",
      "Orange resists rust best"
    ],
    "correct": 1
  }
}
