{
  "id": "energy--energy-storage--t-short-vs-long-duration-storage",
  "version": 1,
  "subject": "Energy",
  "subcategory": "Energy Storage",
  "course_id": "energy--energy-storage",
  "chapter_id": "energy--energy-storage--ch01-why-storage-matters",
  "title": "Short vs Long Duration Storage",
  "emoji": "🔋",
  "color": "#F59E0B",
  "description": "A tiny lesson with a big payoff: Short vs Long Duration Storage.",
  "is_free": false,
  "published": true,
  "story": {
    "hook": {
      "text": "Short-duration storage (2–4 hours) handles daily peaks—long-duration (days to weeks) covers extended weather events.",
      "visual": "⏱️"
    },
    "buildup": {
      "text": "Lithium-ion batteries dominate short-duration—they charge from midday solar and discharge through the evening peak.",
      "visual": "🔋"
    },
    "discovery": {
      "text": "Long-duration storage covers 'dunkelflaute'—German for dark doldrums, when clouds and calm persist for days.",
      "visual": "☁️"
    },
    "twist": {
      "text": "Long-duration tech is far less mature—hydrogen, iron-air batteries, and compressed air are still early-stage.",
      "visual": "🧪"
    },
    "climax": {
      "text": "A 100% renewable grid may need weeks of energy reserves—a challenge no existing battery technology can affordably meet.",
      "visual": "📈"
    },
    "punchline": {
      "text": "Hours or weeks—different timescales need different tech.",
      "visual": "📅"
    }
  },
  "quiz": {
    "question": "What does 'dunkelflaute' refer to?",
    "options": [
      "A battery technology",
      "Extended cloudy, windless periods",
      "A type of solar panel"
    ],
    "correct": 1
  }
}
