{
  "id": "sexual-health--sexual-health-myths--t-the-g-spot-debate",
  "version": 1,
  "subject": "Sexual Health",
  "subcategory": "Sexual Health Myths",
  "course_id": "sexual-health--sexual-health-myths",
  "chapter_id": "sexual-health--sexual-health-myths--ch01-anatomy-myths",
  "title": "The G-Spot Debate",
  "emoji": "ğŸ”",
  "color": "#E11D48",
  "description": "A fast breakdown of The G-Spot Debate for builders.",
  "is_free": false,
  "published": true,
  "story": {
    "hook": {
      "text": "The G-spot has been debated for decades. Is it a real anatomical structure or a myth?",
      "visual": "â“"
    },
    "buildup": {
      "text": "In 1950, Ernst Grafenberg described a sensitive area on the front wall of the vagina. It was later named after him.",
      "visual": "ğŸ“œ"
    },
    "discovery": {
      "text": "Modern imaging suggests the area is where internal clitoral tissue, urethra, and vaginal wall converge.",
      "visual": "ğŸ”¬"
    },
    "twist": {
      "text": "There may be no single spot. Sensitivity varies widely among women, and not everyone finds this area pleasurable.",
      "visual": "ğŸ²"
    },
    "climax": {
      "text": "Fixating on finding a magic spot creates pressure. Pleasure comes from exploration, not a treasure map.",
      "visual": "ğŸ—ºï¸"
    },
    "punchline": {
      "text": "Not a button to find. More like a zone that varies.",
      "visual": "ğŸŒ"
    }
  },
  "quiz": {
    "question": "What does modern science suggest about the G-spot?",
    "options": [
      "It is a clearly defined organ",
      "It is likely a zone where multiple tissues converge",
      "It does not exist at all"
    ],
    "correct": 1
  }
}
