{
  "id": "cognitive-science--cognitive-biases--t-the-halo-effect",
  "version": 1,
  "subject": "Cognitive Science",
  "subcategory": "Cognitive Biases",
  "course_id": "cognitive-science--cognitive-biases",
  "chapter_id": "cognitive-science--cognitive-biases--ch03-social-biases",
  "title": "The Halo Effect",
  "emoji": "🪤",
  "color": "#0891B2",
  "description": "A micro-lesson that makes The Halo Effect usable.",
  "is_free": true,
  "published": true,
  "story": {
    "hook": {
      "text": "Attractive defendants get lighter sentences. Good looks signal nothing about guilt, yet juries are swayed.",
      "visual": "⚖️"
    },
    "buildup": {
      "text": "The halo effect: one positive trait (beauty, fame, confidence) colors judgment of unrelated traits.",
      "visual": "😇"
    },
    "discovery": {
      "text": "Edward Thorndike first documented it in 1920: military officers rated soldiers as good at everything or bad at everything.",
      "visual": "🪖"
    },
    "twist": {
      "text": "It works in reverse too. One negative trait—a lisp, a stain—can make everything about a person seem worse.",
      "visual": "👎"
    },
    "climax": {
      "text": "Brands exploit halos: Apple's design reputation creates a halo that covers its pricing and restrictions.",
      "visual": "🍎"
    },
    "punchline": {
      "text": "One trait shouldn't color the whole picture. But it does.",
      "visual": "🎨"
    }
  },
  "quiz": {
    "question": "What is the halo effect?",
    "options": [
      "One positive trait biases judgment of unrelated traits",
      "People always judge accurately",
      "Negative traits are more influential"
    ],
    "correct": 0
  },
  "details": {
    "summary": "The halo effect causes a positive impression in one area to influence judgments in unrelated areas. An attractive person is assumed to be intelligent and kind. A company with one good product is assumed to make all good products. First impressions radiate outward, coloring everything.",
    "whyItMatters": "The halo effect distorts hiring, grading, product reviews, and legal judgments. It shows how a single salient trait can overwhelm objective evaluation across all dimensions.",
    "takeaways": [
      "One positive trait biases perception of all other traits",
      "Physical attractiveness is the most studied halo trigger",
      "The effect operates automatically and below awareness"
    ],
    "keywords": [
      "halo effect",
      "first impression",
      "judgment bias",
      "Edward Thorndike"
    ],
    "faq": [
      {
        "question": "Who discovered the halo effect?",
        "answer": "Edward Thorndike identified and named the halo effect in 1920 after studying military officer evaluations. He noticed that ratings on one trait like physique were highly correlated with ratings on unrelated traits like intelligence, suggesting a general impression was contaminating all judgments."
      },
      {
        "question": "How does the halo effect influence hiring decisions?",
        "answer": "Interviewers who form a positive first impression tend to rate candidates higher on all dimensions including unrelated competencies. Attractive, confident, or well-spoken candidates benefit disproportionately. Structured interviews with standardized criteria help reduce the effect."
      }
    ]
  }
}
