{
  "id": "real-estate--urban-planning-and-zoning--t-floor-area-ratio-the-invisible-limit",
  "version": 1,
  "subject": "Real Estate",
  "subcategory": "Urban Planning and Zoning",
  "course_id": "real-estate--urban-planning-and-zoning",
  "chapter_id": "real-estate--urban-planning-and-zoning--ch03-density-and-sprawl",
  "title": "Floor Area Ratio: The Invisible Limit",
  "emoji": "ğŸ™ï¸",
  "color": "#C0392B",
  "description": "A micro-lesson that makes Floor Area Ratio: The Invisible Limit usable.",
  "is_free": false,
  "published": true,
  "story": {
    "hook": {
      "text": "On a 10,000 sq ft lot with a FAR of 2.0, you can build 20,000 sq ft of space. The ratio decides the city's shape.",
      "visual": "ğŸ“"
    },
    "buildup": {
      "text": "Floor area ratio controls how much total space can be built on a lot, regardless of height or footprint.",
      "visual": "ğŸ“Š"
    },
    "discovery": {
      "text": "A high FAR allows towers. A low FAR forces single-story buildings. It's the most powerful density tool in zoning.",
      "visual": "ğŸ—ï¸"
    },
    "twist": {
      "text": "Developers sometimes buy FAR from neighboring properties â€” literally purchasing the right to build taller.",
      "visual": "ğŸ“ˆ"
    },
    "climax": {
      "text": "FAR is invisible to most people, but it determines how tall, dense, and expensive every neighborhood becomes.",
      "visual": "ğŸ™ï¸"
    },
    "punchline": {
      "text": "A number most people never see shapes every city skyline.",
      "visual": "ğŸ“"
    }
  },
  "quiz": {
    "question": "What does floor area ratio (FAR) control?",
    "options": [
      "Building color",
      "Total buildable space relative to lot size",
      "Number of parking spaces"
    ],
    "correct": 1
  }
}
