{
  "id": "public-speaking--debate-and-argumentation--t-emotional-appeals-in-debate",
  "version": 1,
  "subject": "Public Speaking",
  "subcategory": "Debate and Argumentation",
  "course_id": "public-speaking--debate-and-argumentation",
  "chapter_id": "public-speaking--debate-and-argumentation--ch04-devices",
  "title": "Emotional Appeals in Debate",
  "emoji": "‚öîÔ∏è",
  "color": "#D35400",
  "description": "A short lesson to help you apply Emotional Appeals in Debate.",
  "is_free": false,
  "published": true,
  "story": {
    "hook": {
      "text": "Pathos without logos is manipulation. Logos without pathos is boring.",
      "visual": "‚ù§Ô∏è"
    },
    "buildup": {
      "text": "Emotional appeals give arguments human impact and urgency.",
      "visual": "üî•"
    },
    "discovery": {
      "text": "The best debaters blend emotion with evidence seamlessly.",
      "visual": "‚öñÔ∏è"
    },
    "twist": {
      "text": "Pure emotion without evidence loses credibility with judges.",
      "visual": "‚ö†Ô∏è"
    },
    "climax": {
      "text": "Balanced pathos makes logical arguments stick in memory.",
      "visual": "üß†"
    },
    "punchline": {
      "text": "Feel and think. Both matter in persuasion.",
      "visual": "üéØ"
    }
  },
  "quiz": {
    "question": "How should emotion be used in debate?",
    "options": [
      "Never",
      "Blended with evidence for impact",
      "Always without logic"
    ],
    "correct": 1
  }
}
