{
  "id": "languages--ancient-languages--t-cuneiform-wedges-that-changed-the-world",
  "version": 1,
  "subject": "Languages",
  "subcategory": "Ancient Languages",
  "course_id": "languages--ancient-languages",
  "chapter_id": "languages--ancient-languages--ch01-sumerian-akkadian",
  "title": "Cuneiform: Wedges That Changed the World",
  "emoji": "ğŸ“œ",
  "color": "#92400E",
  "description": "A quick, practical guide to Cuneiform: Wedges That Changed the World.",
  "is_free": false,
  "published": true,
  "story": {
    "hook": {
      "text": "Cuneiform wasn't an alphabet. It was a system of wedge-shaped marks â€” over 600 different signs.",
      "visual": "ğŸ”¤"
    },
    "buildup": {
      "text": "Scribes pressed a triangular reed stylus into soft clay tablets at different angles.",
      "visual": "âœï¸"
    },
    "discovery": {
      "text": "The system mixed logograms (word signs) and syllabograms (sound signs) â€” maddeningly complex.",
      "visual": "ğŸ§©"
    },
    "twist": {
      "text": "Learning cuneiform took years. Only elite scribes could read and write â€” literacy was rare power.",
      "visual": "ğŸ‘‘"
    },
    "climax": {
      "text": "Cuneiform lasted 3,000 years and was used by Sumerians, Babylonians, Assyrians, and Persians.",
      "visual": "ğŸŒ"
    },
    "punchline": {
      "text": "The world's first writing system was so hard that reading it was a professional career.",
      "visual": "ğŸ“"
    }
  },
  "quiz": {
    "question": "How many signs did the cuneiform system have?",
    "options": [
      "Over 600",
      "26",
      "About 100",
      "Exactly 300"
    ],
    "correct": 0
  }
}
