{
  "id": "supply-chain-logistics--last-mile-delivery--t-delivery-consolidation",
  "version": 1,
  "subject": "Supply Chain & Logistics",
  "subcategory": "Last-Mile Delivery",
  "course_id": "supply-chain-logistics--last-mile-delivery",
  "chapter_id": "supply-chain-logistics--last-mile-delivery--ch06-sustainability-and-future",
  "title": "Delivery Consolidation",
  "emoji": "📦",
  "color": "#0284c7",
  "description": "A quick, practical guide to Delivery Consolidation.",
  "is_free": false,
  "published": true,
  "story": {
    "hook": {
      "text": "You order 3 items from 3 sellers. Three separate vans visit your house on the same day. That's insane.",
      "visual": "🚛"
    },
    "buildup": {
      "text": "Delivery consolidation groups multiple orders for the same address or area into a single delivery trip.",
      "visual": "📦"
    },
    "discovery": {
      "text": "It cuts trips, emissions, and cost. Customers can choose a delivery day to maximize consolidation.",
      "visual": "📅"
    },
    "twist": {
      "text": "Consolidation adds delay. Customers who want everything now resist waiting for batched deliveries.",
      "visual": "⏳"
    },
    "climax": {
      "text": "Amazon's 'Amazon Day' lets customers pick one delivery day per week—consolidating orders automatically.",
      "visual": "📱"
    },
    "punchline": {
      "text": "One trip, many packages. Better for you and the planet.",
      "visual": "🌍"
    }
  },
  "quiz": {
    "question": "What does Amazon Day help customers do?",
    "options": [
      "Get faster shipping",
      "Consolidate orders into one delivery day per week",
      "Return items faster"
    ],
    "correct": 1
  }
}
