{
  "id": "fashion--sustainable-fashion--t-digital-fashion-and-nft-clothing",
  "version": 1,
  "subject": "Fashion",
  "subcategory": "Sustainable Fashion",
  "course_id": "fashion--sustainable-fashion",
  "chapter_id": "fashion--sustainable-fashion--ch06-the-future-of-fashion",
  "title": "Digital Fashion and NFT Clothing",
  "emoji": "â™»ï¸",
  "color": "#16A34A",
  "description": "A micro-lesson that makes Digital Fashion and NFT Clothing usable.",
  "is_free": false,
  "published": true,
  "story": {
    "hook": {
      "text": "People are paying real money for clothes that exist only on screens. Welcome to digital fashion.",
      "visual": "ğŸ’»"
    },
    "buildup": {
      "text": "Digital garments are worn in photos, social media, and virtual worldsâ€”never physically manufactured.",
      "visual": "ğŸ®"
    },
    "discovery": {
      "text": "Zero fabric, zero water, zero shipping. A digital dress has nearly zero environmental footprint.",
      "visual": "ğŸŒ±"
    },
    "twist": {
      "text": "NFT fashion ran on energy-hungry blockchains, and most projects collapsed when the crypto hype faded.",
      "visual": "ğŸ“‰"
    },
    "climax": {
      "text": "The concept survives: dressing your avatar matters where online identity rivals the physical one.",
      "visual": "ğŸª"
    },
    "punchline": {
      "text": "Virtual clothes, real identity. No closet required.",
      "visual": "ğŸ‘¾"
    }
  },
  "quiz": {
    "question": "What is the primary environmental advantage of digital fashion?",
    "options": [
      "It uses renewable energy for all blockchain transactions",
      "It reduces screen time and encourages offline activities",
      "It requires zero physical materials, water, or shipping"
    ],
    "correct": 2
  }
}
