{
  "id": "learning--how-children-learn--t-bilingual-children-two-languages-one-brain",
  "version": 1,
  "subject": "Learning",
  "subcategory": "How Children Learn",
  "course_id": "learning--how-children-learn",
  "chapter_id": "learning--how-children-learn--ch03-language-acquisition",
  "title": "Bilingual Children: Two Languages, One Brain",
  "emoji": "ğŸ‘¶",
  "color": "#F59E0B",
  "description": "A 60-second lesson on Bilingual Children: Two Languages, One Brain.",
  "is_free": false,
  "published": true,
  "story": {
    "hook": {
      "text": "People once feared bilingualism confused children. Research shows it actually enhances their cognitive abilities.",
      "visual": "ğŸŒ"
    },
    "buildup": {
      "text": "Bilingual children's brains constantly manage two language systems, strengthening executive function.",
      "visual": "ğŸ§ "
    },
    "discovery": {
      "text": "They show better attention control, cognitive flexibility, and problem-solving than monolingual peers.",
      "visual": "ğŸ“ˆ"
    },
    "twist": {
      "text": "Bilingual children may have smaller vocabularies in each languageâ€”but their total vocabulary across both is larger.",
      "visual": "ğŸ“Š"
    },
    "climax": {
      "text": "The cognitive benefits of bilingualism persist into old age, even delaying dementia by 4â€“5 years.",
      "visual": "ğŸ§“"
    },
    "punchline": {
      "text": "Two languages don't confuse the brain. They strengthen it for life.",
      "visual": "ğŸ’ª"
    }
  },
  "quiz": {
    "question": "How does bilingualism affect children's cognitive development?",
    "options": [
      "It enhances executive function, attention control, and cognitive flexibility",
      "It confuses children and delays language development",
      "Bilingual children always struggle academically"
    ],
    "correct": 0
  }
}
