{
  "id": "quality-assurance-testing--mobile-testing--t-offline-mode-and-data-sync",
  "version": 1,
  "subject": "Quality Assurance & Testing",
  "subcategory": "Mobile Testing",
  "course_id": "quality-assurance-testing--mobile-testing",
  "chapter_id": "quality-assurance-testing--mobile-testing--ch03-functional-testing",
  "title": "Offline Mode and Data Sync",
  "emoji": "📱",
  "color": "#7C3AED",
  "description": "A quick, practical guide to Offline Mode and Data Sync.",
  "is_free": false,
  "published": true,
  "story": {
    "hook": {
      "text": "A user edits a document offline. When they reconnect, their changes vanish because the server version overwrites.",
      "visual": "📡"
    },
    "buildup": {
      "text": "Offline mode lets users work without connectivity. The challenge is syncing local changes back to the server.",
      "visual": "🔄"
    },
    "discovery": {
      "text": "Testing covers creating, editing, and deleting data offline, then verifying correct sync when connection returns.",
      "visual": "🔍"
    },
    "twist": {
      "text": "Conflict resolution is the hard part: what happens when both offline and online users edit the same record?",
      "visual": "⚡"
    },
    "climax": {
      "text": "Sync tests reveal that offline edits silently lose to server versions. A conflict dialog is added to let users choose.",
      "visual": "✅"
    },
    "punchline": {
      "text": "Offline mode is easy to build, hard to sync. Test the sync.",
      "visual": "🎯"
    }
  },
  "quiz": {
    "question": "What is the hardest part of offline mode testing?",
    "options": [
      "Storing data locally",
      "Conflict resolution when syncing changes back",
      "Detecting network status"
    ],
    "correct": 1
  }
}
