{
  "id": "myth-symbolism--creation-myths-compared--t-from-divine-sacrifice",
  "version": 1,
  "subject": "Myth & Symbolism",
  "subcategory": "Creation Myths Compared",
  "course_id": "myth-symbolism--creation-myths-compared",
  "chapter_id": "myth-symbolism--creation-myths-compared--ch05-making-humans",
  "title": "From Divine Sacrifice",
  "emoji": "🌍",
  "color": "#6A1B9A",
  "description": "A 60-second lesson on From Divine Sacrifice.",
  "is_free": false,
  "published": true,
  "story": {
    "hook": {
      "text": "In the Rig Veda, the cosmic giant Purusha was sacrificed. His body parts became the four castes of society.",
      "visual": "🕉️"
    },
    "buildup": {
      "text": "Norse myth says the first humans, Ask and Embla, were made from driftwood—dead matter given life.",
      "visual": "🪵"
    },
    "discovery": {
      "text": "When gods die to make humans, it means we carry divine substance inside us. We're fragments of the sacred.",
      "visual": "✨"
    },
    "twist": {
      "text": "But sacrifice of a deity also creates hierarchy. Purusha's myth justified India's caste system for millennia.",
      "visual": "⚖️"
    },
    "climax": {
      "text": "Creation from sacrifice says life requires death. Something must end for something else to begin.",
      "visual": "🔄"
    },
    "punchline": {
      "text": "A god died. That's why you exist.",
      "visual": "💫"
    }
  },
  "quiz": {
    "question": "What did the sacrifice of Purusha create in Hindu myth?",
    "options": [
      "The four seasons",
      "The four castes of society",
      "The four elements"
    ],
    "correct": 1
  }
}
