{
  "id": "sociology--race-and-ethnicity--t-racial-categories-change-over-time",
  "version": 1,
  "subject": "Sociology",
  "subcategory": "Race and Ethnicity",
  "course_id": "sociology--race-and-ethnicity",
  "chapter_id": "sociology--race-and-ethnicity--ch01-race-as-a-social-construct",
  "title": "Racial Categories Change Over Time",
  "emoji": "🌍",
  "color": "#6366F1",
  "description": "A fast breakdown of Racial Categories Change Over Time for builders.",
  "is_free": false,
  "published": true,
  "story": {
    "hook": {
      "text": "The U.S. Census has changed its racial categories 26 times since 1790. If race were natural, why keep redefining it?",
      "visual": "📝"
    },
    "buildup": {
      "text": "In 1890, the Census tracked mulatto, quadroon, and octoroon. By 1930, those vanished into a single Black category.",
      "visual": "📊"
    },
    "discovery": {
      "text": "The one-drop rule defined anyone with any Black ancestry as Black. No other group had a similar rule applied.",
      "visual": "💧"
    },
    "twist": {
      "text": "Hispanic wasn't a racial category until 1970. Today, millions check it while also identifying as white or Black.",
      "visual": "🔀"
    },
    "climax": {
      "text": "Racial categories reflect political needs, not natural divisions. They change when power dynamics shift.",
      "visual": "🔄"
    },
    "punchline": {
      "text": "If race were natural, the Census wouldn't need to reinvent it.",
      "visual": "🔑"
    }
  },
  "quiz": {
    "question": "What does the changing U.S. Census reveal about race?",
    "options": [
      "Racial categories reflect politics, not biology",
      "Race has remained consistent throughout history",
      "The Census has never tracked race"
    ],
    "correct": 0
  }
}
