{
  "id": "fashion--fashion-business-and-economics--t-wholesale-vs-direct-to-consumer",
  "version": 1,
  "subject": "Fashion",
  "subcategory": "Fashion Business & Economics",
  "course_id": "fashion--fashion-business-and-economics",
  "chapter_id": "fashion--fashion-business-and-economics--ch01-how-the-industry-works",
  "title": "Wholesale vs Direct-to-Consumer",
  "emoji": "ğŸ’¼",
  "color": "#6366F1",
  "description": "A micro-lesson that makes Wholesale vs Direct-to-Consumer usable.",
  "is_free": false,
  "published": true,
  "story": {
    "hook": {
      "text": "A $100 shirt sold wholesale earns $50. Sold direct? Up to $85.",
      "visual": "ğŸ’µ"
    },
    "buildup": {
      "text": "Wholesale means selling to retailers who mark up and resell to you.",
      "visual": "ğŸ¬"
    },
    "discovery": {
      "text": "Direct-to-consumer cuts the middlemanâ€”brands sell straight to shoppers online.",
      "visual": "ğŸ“±"
    },
    "twist": {
      "text": "But DTC brands must fund their own marketing, shipping, and returns.",
      "visual": "ğŸ“¦"
    },
    "climax": {
      "text": "Most successful brands now blend both channels for margin and reach.",
      "visual": "âš–ï¸"
    },
    "punchline": {
      "text": "Higher margins mean nothing without customers.",
      "visual": "ğŸ¯"
    }
  },
  "quiz": {
    "question": "Why do DTC brands earn higher margins?",
    "options": [
      "Products cost less to make",
      "They skip the retailer markup",
      "Customers pay more online"
    ],
    "correct": 1
  }
}
