{
  "id": "engineering-fundamentals--civil-engineering-wonders--t-highway-interchanges-solving-traffic-in-three-dimensions",
  "version": 1,
  "subject": "Engineering Fundamentals",
  "subcategory": "Civil Engineering Wonders",
  "course_id": "engineering-fundamentals--civil-engineering-wonders",
  "chapter_id": "engineering-fundamentals--civil-engineering-wonders--ch02-roads-and-highways",
  "title": "Highway Interchanges: Solving Traffic in Three Dimensions",
  "emoji": "🏛️",
  "color": "#00695C",
  "description": "A 60-second lesson on Highway Interchanges: Solving Traffic in Three Dimensions.",
  "is_free": false,
  "published": true,
  "story": {
    "hook": {
      "text": "A cloverleaf interchange lets traffic flow in all directions without a single traffic light. Geometry replaces stopping.",
      "visual": "🍀"
    },
    "buildup": {
      "text": "The simplest interchange is a diamond — four ramps connecting a highway to a surface street. It works but has left-turn conflicts.",
      "visual": "💎"
    },
    "discovery": {
      "text": "Cloverleaf loops eliminate left turns by routing drivers in 270-degree loops. The trade-off is large land use and weaving traffic.",
      "visual": "🔄"
    },
    "twist": {
      "text": "The diverging diamond interchange briefly flips traffic to the opposite side of the road. It eliminates left-turn conflicts.",
      "visual": "🔀"
    },
    "climax": {
      "text": "Stack interchanges in Los Angeles rise five levels high. The Judge Pregerson interchange has 34 ramps across four freeways.",
      "visual": "🏗️"
    },
    "punchline": {
      "text": "No lights. No stops. Just ramps, loops, and geometry in motion.",
      "visual": "🎯"
    }
  },
  "quiz": {
    "question": "How does a diverging diamond interchange improve traffic flow?",
    "options": [
      "It uses underground tunnels to separate highway and surface traffic entirely",
      "It briefly flips opposing traffic to the opposite side to eliminate left-turn conflicts",
      "It replaces all ramps with roundabouts that keep traffic moving continuously"
    ],
    "correct": 1
  }
}
