{
  "id": "e-commerce--psychology-of-online-buying--t-exit-intent-pop-ups",
  "version": 1,
  "subject": "E-Commerce",
  "subcategory": "Psychology of Online Buying",
  "course_id": "e-commerce--psychology-of-online-buying",
  "chapter_id": "e-commerce--psychology-of-online-buying--ch05-cart-abandonment",
  "title": "Exit Intent Pop-Ups",
  "emoji": "🧠",
  "color": "#00897B",
  "description": "A micro-lesson that makes Exit Intent Pop-Ups usable.",
  "is_free": false,
  "published": true,
  "story": {
    "hook": {
      "text": "Move your mouse toward the browser's close button and a pop-up appears: '10% off if you stay!' It's tracking you.",
      "visual": "🖱️"
    },
    "buildup": {
      "text": "Exit-intent technology detects cursor movement toward the address bar or tab close button on desktop.",
      "visual": "👀"
    },
    "discovery": {
      "text": "Exit pop-ups recover 10-15% of leaving visitors. A last-second offer converts people who were about to leave.",
      "visual": "📈"
    },
    "twist": {
      "text": "On mobile, there's no cursor. Mobile sites use scroll-up speed or back-button taps to detect exit intent.",
      "visual": "📱"
    },
    "climax": {
      "text": "Exit pop-ups are annoying but profitable. The tension between UX quality and revenue drives endless debate.",
      "visual": "⚖️"
    },
    "punchline": {
      "text": "Your cursor tells on you. Moving to leave triggers a last-ditch rescue offer.",
      "visual": "🖱️"
    }
  },
  "quiz": {
    "question": "How do exit-intent pop-ups know you're leaving?",
    "options": [
      "Time on page",
      "They detect cursor movement toward the browser close or address bar",
      "They appear randomly"
    ],
    "correct": 1
  }
}
