{
  "id": "first-aid-safety--history-of-first-aid--t-wound-care-in-ancient-egypt",
  "version": 1,
  "subject": "First Aid & Safety",
  "subcategory": "History of First Aid",
  "course_id": "first-aid-safety--history-of-first-aid",
  "chapter_id": "first-aid-safety--history-of-first-aid--ch01-ancient-origins",
  "title": "Wound Care in Ancient Egypt",
  "emoji": "📜",
  "color": "#92400E",
  "description": "Learn Wound Care in Ancient Egypt in one minute.",
  "is_free": true,
  "published": true,
  "story": {
    "hook": {
      "text": "A 3,600-year-old papyrus describes how to treat 48 different injuries. Ancient Egypt had ER docs.",
      "visual": "📜"
    },
    "buildup": {
      "text": "The Edwin Smith Papyrus is the oldest known surgical text, written around 1600 BCE.",
      "visual": "🏛️"
    },
    "discovery": {
      "text": "It describes wound closure with stitches, splints for fractures, and honey as antiseptic.",
      "visual": "🍯"
    },
    "twist": {
      "text": "Honey actually works—modern science confirms it kills bacteria and promotes healing.",
      "visual": "🔬"
    },
    "climax": {
      "text": "Egyptian physicians categorized injuries as treatable, contestable, or untreatable.",
      "visual": "📋"
    },
    "punchline": {
      "text": "Triage is 3,600 years old. Egypt invented it.",
      "visual": "⚕️"
    }
  },
  "quiz": {
    "question": "What ancient substance is now proven to have antibacterial properties?",
    "options": [
      "Honey",
      "Olive oil",
      "Salt water"
    ],
    "correct": 0
  }
}
