{
  "id": "business--financial-literacy--t-dollar-cost-averaging",
  "version": 1,
  "subject": "Business",
  "subcategory": "Financial Literacy",
  "course_id": "business--financial-literacy",
  "chapter_id": "business--financial-literacy--ch03-investing",
  "title": "Dollar-Cost Averaging",
  "emoji": "💵",
  "color": "#16A085",
  "description": "Learn Dollar-Cost Averaging in one minute.",
  "is_free": false,
  "published": true,
  "story": {
    "hook": {
      "text": "You invest $500 monthly regardless of market price. Some months you buy high, some low.",
      "visual": "📆"
    },
    "buildup": {
      "text": "Dollar-cost averaging means investing a fixed amount at regular intervals, ignoring market timing entirely.",
      "visual": "📊"
    },
    "discovery": {
      "text": "When prices drop, your fixed amount buys more shares. When prices rise, it buys fewer. Volatility works for you.",
      "visual": "🔄"
    },
    "twist": {
      "text": "Lump-sum investing actually beats DCA two-thirds of the time — but DCA prevents the fear that stops people from investing.",
      "visual": "😰"
    },
    "climax": {
      "text": "The best investment plan is one you actually follow. DCA's simplicity keeps people investing through every market cycle.",
      "visual": "🏃"
    },
    "punchline": {
      "text": "Don't time the market. Time in the market wins.",
      "visual": "⏰"
    }
  },
  "quiz": {
    "question": "What is the main behavioral advantage of dollar-cost averaging?",
    "options": [
      "It removes the fear and hesitation that stops people from investing",
      "It always produces higher returns than lump-sum investing",
      "It eliminates market risk entirely"
    ],
    "correct": 0
  }
}
