{
  "id": "education--early-childhood-development--t-serve-and-return-the-conversation-that-builds-brains",
  "version": 1,
  "subject": "Education",
  "subcategory": "Early Childhood Development",
  "course_id": "education--early-childhood-development",
  "chapter_id": "education--early-childhood-development--ch06-family-and-environment",
  "title": "Serve and Return: The Conversation That Builds Brains",
  "emoji": "ğŸ§’",
  "color": "#E11D48",
  "description": "One-minute skill: Serve and Return: The Conversation That Builds Brains.",
  "is_free": true,
  "published": true,
  "story": {
    "hook": {
      "text": "A baby points at a dog. The parent says 'Yes! A dog! Woof woof!' That exchange builds a brain.",
      "visual": "ğŸ•"
    },
    "buildup": {
      "text": "Serve and return interactions are the back-and-forth exchanges between caregiver and child.",
      "visual": "ğŸ“"
    },
    "discovery": {
      "text": "These interactions build neural connections, especially in areas responsible for communication and social skills.",
      "visual": "ğŸ§ "
    },
    "twist": {
      "text": "A parent distracted by a phone misses dozens of serve-and-return opportunities every hour.",
      "visual": "ğŸ“±"
    },
    "climax": {
      "text": "The quantity and quality of these exchanges in the first years predict language ability at age 5.",
      "visual": "ğŸ“Š"
    },
    "punchline": {
      "text": "Every time you respond to a baby, you're wiring their brain for connection.",
      "visual": "ğŸ”Œ"
    }
  },
  "quiz": {
    "question": "What are 'serve and return' interactions?",
    "options": [
      "Back-and-forth exchanges between caregiver and child that build neural connections",
      "A type of physical therapy for infants",
      "A teaching method used only in preschools"
    ],
    "correct": 0
  }
}
