{
  "id": "nanotechnology--nanofabrication--t-chemical-vapor-deposition",
  "version": 1,
  "subject": "Nanotechnology",
  "subcategory": "Nanofabrication",
  "course_id": "nanotechnology--nanofabrication",
  "chapter_id": "nanotechnology--nanofabrication--ch02-deposition-techniques",
  "title": "Chemical Vapor Deposition",
  "emoji": "⚙️",
  "color": "#6A1B9A",
  "description": "A fast breakdown of Chemical Vapor Deposition for builders.",
  "is_free": false,
  "published": true,
  "story": {
    "hook": {
      "text": "Pump reactive gases into a hot chamber and watch a perfectly uniform film grow on every exposed surface.",
      "visual": "💨"
    },
    "buildup": {
      "text": "Chemical vapor deposition, or CVD, builds films from gas-phase reactions that deposit atoms on the wafer.",
      "visual": "🧪"
    },
    "discovery": {
      "text": "CVD coats all surfaces evenly — even inside deep trenches — because gas molecules diffuse everywhere.",
      "visual": "🔲"
    },
    "twist": {
      "text": "The process temperature can exceed 800°C, which limits what materials can survive underneath.",
      "visual": "🔥"
    },
    "climax": {
      "text": "Silicon dioxide, silicon nitride, and even diamond-like carbon films are all deposited by CVD.",
      "visual": "💎"
    },
    "punchline": {
      "text": "Gas in, solid film out — chemistry builds nanoscale layers.",
      "visual": "🏗️"
    }
  },
  "quiz": {
    "question": "What advantage does CVD have over PVD?",
    "options": [
      "It works at room temperature",
      "It coats all surfaces evenly, including inside deep features",
      "It uses less energy per wafer"
    ],
    "correct": 1
  }
}
