{
  "id": "photography--photography-and-society--t-photography-and-civil-rights",
  "version": 1,
  "subject": "Photography",
  "subcategory": "Photography & Society",
  "course_id": "photography--photography-and-society",
  "chapter_id": "photography--photography-and-society--ch04-movements",
  "title": "Photography and Civil Rights",
  "emoji": "üì∞",
  "color": "#D97706",
  "description": "A tiny lesson with a big payoff: Photography and Civil Rights.",
  "is_free": true,
  "published": true,
  "story": {
    "hook": {
      "text": "Images of fire hoses aimed at children. Dogs attacking peaceful marchers. Photography made injustice undeniable.",
      "visual": "‚úä"
    },
    "buildup": {
      "text": "The U.S. Civil Rights Movement was one of the most photographed social struggles in history.",
      "visual": "üì∏"
    },
    "discovery": {
      "text": "Gordon Parks and Ernest Withers documented the movement, creating images that galvanized widespread public support.",
      "visual": "üì∞"
    },
    "twist": {
      "text": "These photos didn't just document change ‚Äî they caused it. Visual evidence made denial of injustice impossible.",
      "visual": "üëÅÔ∏è"
    },
    "climax": {
      "text": "Photography gave the Civil Rights Movement a visual language that transcended barriers of geography and literacy.",
      "visual": "üåç"
    },
    "punchline": {
      "text": "You can deny words. You can't deny a photograph.",
      "visual": "üîí"
    }
  },
  "quiz": {
    "question": "How did photography contribute to the Civil Rights Movement?",
    "options": [
      "Images made injustice visually undeniable and galvanized public support",
      "It had no significant impact",
      "Only text journalism mattered"
    ],
    "correct": 0
  }
}
